{"schema_version": 1, "gate_id": "gate-S-001", "run_id": "20260930-120000-run-1", "plan_digest": "aaaaaaaaaaaaaaaaaaaaaaaaaaaaaaaaaaaaaaaaaaaaaaaaaaaaaaaaaaaaaaaa", "contract_digest": "aaaaaaaaaaaaaaaaaaaaaaaaaaaaaaaaaaaaaaaaaaaaaaaaaaaaaaaaaaaaaaaa", "step_id": "S-001", "candidate_sha": "0123456789abcdef0123456789abcdef01234567"}
